{
  "schemaVersion": 1,
  "id": "hint-master/both-level-1",
  "area": "scoring.hint-master",
  "title": "Knowing artist and title at level 1 awards the full five points",
  "reference": "src/components/game/modes/HintMasterMode.tsx:65-74",
  "portable": true,
  "given": {
    "config": {
      "selectedModes": [
        "hint-master"
      ]
    },
    "players": [
      {
        "id": "p1",
        "name": "Ada",
        "score": 0,
        "teamId": null,
        "isEliminated": false,
        "isSpectator": false,
        "isPilot": false
      }
    ],
    "turnOrder": [
      "p1"
    ],
    "currentRound": 1,
    "roundPhase": "question",
    "currentMode": "hint-master",
    "currentSong": "s-a",
    "songs": {
      "s-a": {
        "id": "s-a",
        "title": "Example Song",
        "artist": "The Example",
        "year": 1985,
        "country": "US",
        "genre": "Rock",
        "difficulty": "medium",
        "mood": [
          "Dance Floor",
          "Epic"
        ],
        "packs": [
          "Rock Anthems"
        ],
        "hints": [
          "Hint one",
          "Hint two",
          "Hint three",
          "Hint four",
          "Hint five"
        ],
        "lyrics": {
          "real": [
            "Real one",
            "Real two",
            "Real three"
          ],
          "fake": "Fake one"
        },
        "isOneHitWonder": false,
        "supportedModes": [
          "timeline",
          "hint-master",
          "lyrics",
          "vibe-check",
          "survivor",
          "cover-confusion"
        ],
        "isQRCompatible": true,
        "links": {
          "youtube": "https://www.youtube.com/watch?v=aaaaaaaaaaa"
        }
      }
    }
  },
  "when": [
    {
      "op": "answer",
      "mode": "hint-master",
      "answer": {
        "kind": "hint-master",
        "level": 1,
        "knew": "both"
      }
    }
  ],
  "then": {
    "phases": [
      "question"
    ],
    "currentRound": 1,
    "currentMode": "hint-master",
    "currentSongId": "s-a",
    "currentSongSource": "random",
    "autoDrawIntent": false,
    "playerScores": {
      "p1": 5
    },
    "teamScores": {},
    "playerTeams": {
      "p1": null
    },
    "teamMembers": {},
    "turnOrder": [
      "p1"
    ],
    "currentTurnIndex": 0,
    "winnerId": null,
    "isGameOver": false,
    "timelineYears": [],
    "playedSongIds": [
      "s-a"
    ],
    "answers": [
      {
        "playerId": "p1",
        "answer": "correct",
        "outcome": "correct",
        "isCorrect": true,
        "pointsAwarded": 5,
        "answeredInSeconds": null
      }
    ],
    "roundCount": 0,
    "totalXP": 0,
    "censorHint": null,
    "filteredSongIds": null,
    "error": null
  }
}
