{
  "schemaVersion": 1,
  "id": "round/next-round-without-song-does-not-log",
  "area": "round-logic",
  "title": "A round without a drawn song is not written into the history",
  "reference": "src/stores/game-store.ts:331-343",
  "portable": true,
  "given": {
    "config": {
      "selectedModes": [
        "timeline"
      ],
      "endingCondition": "rounds",
      "targetRounds": 30
    },
    "players": [
      {
        "id": "p1",
        "name": "Ada",
        "score": 0,
        "teamId": null,
        "isEliminated": false,
        "isSpectator": false,
        "isPilot": false
      }
    ],
    "turnOrder": [
      "p1"
    ],
    "currentRound": 1,
    "roundPhase": "reveal",
    "currentMode": "timeline"
  },
  "when": [
    {
      "op": "nextRound"
    }
  ],
  "then": {
    "phases": [
      "drawing"
    ],
    "currentRound": 2,
    "currentMode": "timeline",
    "currentSongId": null,
    "currentSongSource": null,
    "autoDrawIntent": false,
    "playerScores": {
      "p1": 0
    },
    "teamScores": {},
    "playerTeams": {
      "p1": null
    },
    "teamMembers": {},
    "turnOrder": [
      "p1"
    ],
    "currentTurnIndex": 0,
    "winnerId": null,
    "isGameOver": false,
    "timelineYears": [],
    "playedSongIds": [],
    "answers": [],
    "roundCount": 0,
    "totalXP": 0,
    "censorHint": null,
    "filteredSongIds": null,
    "error": null
  }
}
