{
  "schemaVersion": 1,
  "id": "phase/start-game-turn-order-individual",
  "area": "phase-machine",
  "title": "startGame builds the turn order from the players in the individual mode",
  "reference": "src/stores/game-store.ts:255-275",
  "portable": true,
  "given": {
    "config": {
      "selectedModes": [
        "timeline"
      ],
      "teamMode": "individual"
    },
    "players": [
      {
        "id": "p1",
        "name": "Ada",
        "score": 0,
        "teamId": null,
        "isEliminated": false,
        "isSpectator": false,
        "isPilot": false
      },
      {
        "id": "p2",
        "name": "Bo",
        "score": 0,
        "teamId": null,
        "isEliminated": false,
        "isSpectator": false,
        "isPilot": false
      }
    ],
    "teams": [
      {
        "id": "t1",
        "name": "Team One",
        "playerIds": [],
        "score": 0,
        "color": "#FF6B35"
      },
      {
        "id": "t2",
        "name": "Team Two",
        "playerIds": [],
        "score": 0,
        "color": "#FF6B35"
      }
    ],
    "currentRound": 0,
    "roundPhase": "drawing",
    "currentMode": "timeline"
  },
  "when": [
    {
      "op": "startGame"
    }
  ],
  "then": {
    "phases": [
      "drawing"
    ],
    "currentRound": 1,
    "currentMode": "timeline",
    "currentSongId": null,
    "currentSongSource": null,
    "autoDrawIntent": false,
    "playerScores": {
      "p1": 0,
      "p2": 0
    },
    "teamScores": {
      "t1": 0,
      "t2": 0
    },
    "playerTeams": {
      "p1": null,
      "p2": null
    },
    "teamMembers": {
      "t1": [],
      "t2": []
    },
    "turnOrder": [
      "p1",
      "p2"
    ],
    "currentTurnIndex": 0,
    "winnerId": null,
    "isGameOver": false,
    "timelineYears": [],
    "playedSongIds": [],
    "answers": [],
    "roundCount": 0,
    "totalXP": 0,
    "censorHint": null,
    "filteredSongIds": null,
    "error": null
  }
}
